source_kind,external_id,title,path,mime_type,url,created_time,modified_time,priority,status,legal_status,notes
boe_consolidado,BOE-A-1987-12077,Ley Organica 2/1987 Conflictos Jurisdiccionales,data/sources/leyes_originales/BOE_consolidadas/BOE-A-1987-12077_LO_2-1987_Conflictos_Jurisdiccionales.pdf,application/pdf,https://www.boe.es/buscar/pdf/1987/BOE-A-1987-12077-consolidado.pdf,,,alta,descargado,pendiente_de_validacion,Indicacion auxiliar Autentica para tema PE-03.
boe_consolidado,BOE-A-2003-20254,Ley 33/2003 Patrimonio Administraciones Publicas,data/sources/leyes_originales/BOE_consolidadas/BOE-A-2003-20254_Ley_33-2003_Patrimonio_AAPP.pdf,application/pdf,https://www.boe.es/buscar/pdf/2003/BOE-A-2003-20254-consolidado.pdf,,,alta,descargado,pendiente_de_validacion,Indicacion auxiliar Autentica para legislacion basica estatal de patrimonio.
boe_consolidado,BOE-A-1986-1216,Real Decreto 33/1986 Regimen Disciplinario Funcionarios,data/sources/leyes_originales/BOE_consolidadas/BOE-A-1986-1216_RD_33-1986_Regimen_Disciplinario.pdf,application/pdf,https://www.boe.es/buscar/pdf/1986/BOE-A-1986-1216-consolidado.pdf,,,alta,descargado,pendiente_de_validacion,Indicacion auxiliar Autentica para regimen disciplinario.
boe_consolidado,BOE-A-1998-8202,Ley 13/1997 Tramo autonomico IRPF y tributos cedidos CV,data/sources/leyes_originales/BOE_consolidadas/BOE-A-1998-8202_Ley_13-1997_Tributos_Cedidos_CV.pdf,application/pdf,https://www.boe.es/buscar/pdf/1998/BOE-A-1998-8202-consolidado.pdf,,,alta,descargado,pendiente_de_validacion,Indicacion auxiliar Autentica para financiacion autonomica.
boe_consolidado,BOE-A-2001-24963,Ley 22/2001 Fondos de Compensacion Interterritorial,data/sources/leyes_originales/BOE_consolidadas/BOE-A-2001-24963_Ley_22-2001_Fondos_Compensacion_Interterritorial.pdf,application/pdf,https://www.boe.es/buscar/pdf/2001/BOE-A-2001-24963-consolidado.pdf,,,alta,descargado,pendiente_de_validacion,Indicacion auxiliar Autentica para financiacion autonomica.
boe_consolidado,BOE-A-2014-8132,Real Decreto 635/2014 Periodo Medio Pago Proveedores,data/sources/leyes_originales/BOE_consolidadas/BOE-A-2014-8132_RD_635-2014_PMP.pdf,application/pdf,https://www.boe.es/buscar/pdf/2014/BOE-A-2014-8132-consolidado.pdf,,,alta,descargado,pendiente_de_validacion,Indicacion auxiliar Autentica para periodo medio de pago a proveedores.
boe_consolidado,BOE-A-2019-967,Ley 25/2018 Grupos de Interes Comunitat Valenciana,data/sources/leyes_originales/BOE_consolidadas/BOE-A-2019-967_Ley_25-2018_Grupos_Interes_CV.pdf,application/pdf,https://www.boe.es/buscar/pdf/2019/BOE-A-2019-967-consolidado.pdf,,,alta,descargado,pendiente_de_validacion,Indicacion auxiliar Autentica para gobierno abierto y grupos de interes.
boe_consolidado,BOE-A-2016-11021,Ley 8/2016 Incompatibilidades Conflictos Intereses Cargos Publicos CV,data/sources/leyes_originales/BOE_consolidadas/BOE-A-2016-11021_Ley_8-2016_Conflictos_Intereses_CV.pdf,application/pdf,https://www.boe.es/buscar/pdf/2016/BOE-A-2016-11021-consolidado.pdf,,,alta,descargado,pendiente_de_validacion,Indicacion auxiliar Autentica para conflicto de interes autonomico.
dogv_pdf,DOGV-A-20061218-R-20240306-CORTS,Reglamento de Les Corts consolidado DOGV,data/sources/leyes_originales/DOGV/DOGV-A_20061218_R_20240306_Reglamento_Les_Corts.pdf,application/pdf,https://dogv.gva.es/auto/docvpub/rlgv/2006/A_20061218_ca_R_20240306.pdf,,,alta,descargado,pendiente_de_validacion,Indicacion auxiliar Autentica para tema PG-08.
dogv_html,DOGV-2017-860,Decreto 3/2017 Seleccion Provision Movilidad Funcion Publica Valenciana,data/sources/leyes_originales/DOGV/DOGV-2017-860_Decreto_3-2017_Seleccion_Provision_Movilidad.html,text/html,https://dogv.gva.es/es/resultat-dogv?L=0&sig=000860%2F2017&url_lista=,,,alta,descargado,pendiente_de_validacion,Indicacion auxiliar Autentica para temas PE-35 y PE-36.
dogv_pdf,DOGV-D-2019-042-CONS,Decreto 42/2019 Condiciones Trabajo Personal Funcionario Generalitat consolidado DOGV,data/sources/leyes_originales/DOGV/DOGV-D_2019_042_Decreto_42-2019_Condiciones_Trabajo.pdf,application/pdf,https://dogv.gva.es/auto/docvpub/rlgv/2019/D_2019_042_ca_TS_20220629.pdf,,,alta,descargado,pendiente_de_validacion,Indicacion auxiliar Autentica para permisos y condiciones de trabajo; pendiente comprobar modificaciones posteriores.
dogv_html,DOGV-D-2021-049,Decreto 49/2021 Teletrabajo Generalitat,data/sources/leyes_originales/DOGV/DOGV-D_2021_049_Decreto_49-2021_Teletrabajo.html,text/html,https://dogv.gva.es/es/eli/es-vc/d/2021/04/01/49/,,,alta,descargado,pendiente_de_validacion,Indicacion auxiliar Autentica para teletrabajo.
dogv_html,DOGV-2017-2595,Decreto 25/2017 Fondos de Caja Fija,data/sources/leyes_originales/DOGV/DOGV-2017-2595_Decreto_25-2017_Caja_Fija.html,text/html,https://dogv.gva.es/portal/ficha_disposicion.jsp?L=1&sig=002595%2F2017&url_lista=+,,,alta,descargado,pendiente_de_validacion,Indicacion auxiliar Autentica para gestion presupuestaria.
dogv_pdf,DOGV-2024-4,Orden 18/2023 NEFIS,data/sources/leyes_originales/DOGV/DOGV-2024-4_Orden_18-2023_NEFIS.pdf,application/pdf,https://dogv.gva.es/datos/2024/01/04/pdf/2024_4.pdf,,,alta,descargado,pendiente_de_validacion,Indicacion auxiliar Autentica para normas de funcionamiento del presupuesto.
dogv_html,DOGV-2001-5331,Orden 27 diciembre 2001 Clasificacion Economica Generalitat,data/sources/leyes_originales/DOGV/DOGV-2001-5331_Orden_Clasificacion_Economica.html,text/html,https://dogv.gva.es/es/disposicio?sig=5331/2001&url_lista=,,,alta,descargado,pendiente_de_validacion,Indicacion auxiliar Autentica para clasificacion economica presupuestaria.
eurlex_html,EURLEX-12012P-TXT,Carta de Derechos Fundamentales de la Union Europea,data/sources/leyes_originales/EURLEX/EURLEX-12012P-TXT_Carta_Derechos_Fundamentales_UE.html,text/html,https://eur-lex.europa.eu/legal-content/ES/TXT/HTML/?uri=CELEX:12012P/TXT,,,alta,error_descarga,pendiente_de_validacion,Indicacion auxiliar Autentica para temas UE y buena administracion.
eurlex_html,EURLEX-02016R0679-20160504,Reglamento UE 2016/679 Proteccion Datos RGPD,data/sources/leyes_originales/EURLEX/EURLEX-02016R0679-20160504_RGPD.html,text/html,https://eur-lex.europa.eu/legal-content/ES/TXT/HTML/?uri=CELEX:02016R0679-20160504,,,alta,error_descarga,pendiente_de_validacion,Indicacion auxiliar Autentica para proteccion de datos.
eurlex_html,EURLEX-32024R2509,Reglamento UE Euratom 2024/2509 Normas financieras presupuesto UE,data/sources/leyes_originales/EURLEX/EURLEX-32024R2509_Reglamento_Financiero_UE_2024.html,text/html,https://eur-lex.europa.eu/legal-content/ES/TXT/HTML/?uri=CELEX:32024R2509,,,alta,error_descarga,pendiente_de_validacion,Sustituye al Reglamento UE Euratom 2018/1046 citado por Autentica para conflicto de interes en fondos europeos; requiere validacion fina.
